{
  "episode_id": "demo_ep_001",
  "clips": [
    {
      "clip_id": "demo_hook",
      "path": "output/demo_hook.mp4",
      "offset_s": 0.0,
      "events_path": "docs/contracts/fixtures/events.min.json",
      "layout_path": "docs/contracts/fixtures/layout.min.json"
    },
    {
      "clip_id": "demo_context",
      "path": "output/demo_context.mp4",
      "offset_s": 8.0
    }
  ],
  "transitions": [
    {
      "after_clip_id": "demo_hook",
      "type": "whoosh",
      "duration": 0.25
    }
  ],
  "audio": {
    "vo": "episodes/demo_ep_001/vo.wav"
  },
  "export": {
    "profiles": ["yt_long"]
  },
  "flags": {
    "captions": true,
    "sound": true,
    "grade": true
  }
}
